31R455,Tottenville High School,10312,STATEN IS
30Q450,Long Island City High School,11106,QUEENS   
30Q445,William Cullen Bryant High School,11103,QUEENS   
30Q501,Frank Sinatra School of the Arts High School,11106,QUEENS   
26Q430,Francis Lewis High School,11365,QUEENS   
25Q285,World Journalism Preparatory: A College Board School,11358,QUEENS   
28Q690,High School for Law Enforcement and Public Safety,11434,QUEENS   
20K485,High School of Telecommunication Arts and Technology,11220,BROOKLYN 
20K490,Fort Hamilton High School,11209,BROOKLYN 
26Q495,Bayside High School,11361,QUEENS   
16K765,Nelson Mandela High School,11213,BROOKLYN 
13K595,Bedford Academy High School,11216,BROOKLYN 
16K455,Boys and Girls High School,11213,BROOKLYN 
16K393,Frederick Douglass Academy IV Secondary School,11221,BROOKLYN 
16K688,The Brooklyn Academy of Global Finance,11221,BROOKLYN 
16K498,Brooklyn High School for Law and Technology,11221,BROOKLYN 
16K594,Gotham Professional Arts Academy,11233,BROOKLYN 
26Q435,Martin Van Buren High School,11427,QUEENS   
26Q566,"Queens High School of Teaching, Liberal Arts and the Sciences",11426,QUEENS   
26Q315,Business Technology Early College High School (BTECH),11427,QUEENS   
10X243,West Bronx Academy for the Future,10458,BRONX    
10X524,Crotona International High School,10458,BRONX    
10X565,High School for Energy and Technology,10458,BRONX    
10X438,Fordham Leadership Academy for Business and Technology,10458,BRONX    
10X434,Belmont Preparatory High School,10458,BRONX    
10X374,Knowledge and Power Preparatory Academy International High School (KAPPA),10458,BRONX    
10X437,Fordham High School for the Arts,10458,BRONX    
10X439,Bronx High School for Law and Community Service,10458,BRONX    
10X264,Bronx Academy for Software Engineering (BASE),10458,BRONX    
21K690,Brooklyn Studio Secondary School,11214,BROOKLYN 
20K445,New Utrecht High School,11214,BROOKLYN 
19K422,Spring Creek Community School,11208,BROOKLYN 
20K505,Franklin Delano Roosevelt High School,11204,BROOKLYN 
20K609,Urban Assembly School for Criminal Justice,11204,BROOKLYN 
27Q262,Channel View School for Research,11694,QUEENS   
27Q324,Rockaway Park High School for Environmental Sustainability,11694,QUEENS   
27Q351,Rockaway Collegiate High School,11694,QUEENS   
27Q323,Scholars' Academy,11694,QUEENS   
28Q620,Thomas A. Edison Career and Technical Education High School,11432,QUEENS   
postcode,Hillcrest High School,11432,QUEENS   
postcode,Hillside Arts & Letters Academy,11432,QUEENS   
28Q896,"Young Women's Leadership School, Queens (TYWLS)",11432,QUEENS   
28Q350,Jamaica Gateway to the Sciences,11432,QUEENS   
28Q310,Queens Collegiate: A College Board School,11432,QUEENS   
28Q328,High School for Community Leadership,11432,QUEENS   
21K620,William E. Grady Career and Technical Education High School,11235,BROOKLYN 
11X542,Pelham Preparatory Academy,10469,BRONX    
11X288,Collegiate Institute for Math and Science (CIMS),10469,BRONX    
11X509,High School of Language and Innovation,10469,BRONX    
11X299,Astor Collegiate Academy,10469,BRONX    
11X508,Bronxdale High School,10469,BRONX    
23K647,Metropolitan Diploma Plus High School,11212,BROOKLYN 
23K514,Frederick Douglass Academy VII High School,11212,BROOKLYN 
23K697,Teachers Preparatory High School,11212,BROOKLYN 
32K554,All City Leadership Secondary School,11237,BROOKLYN 
32K403,Academy for Environmental Leadership,11237,BROOKLYN 
32K545,EBC High School for Public Service - Bushwick,11221,BROOKLYN 
14K474,PROGRESS High School for Professional Careers,11211,BROOKLYN 
14K614,Young Women's Leadership School of Brooklyn (TYWLS),11206,BROOKLYN 
14K478,"The High School for Enterprise, Business and Technology",11211,BROOKLYN 
32K556,Bushwick Leaders High School for Academic Excellence,11221,BROOKLYN 
32K549,Bushwick School for Social Justice,11237,BROOKLYN 
14K477,School for Legal Studies,11211,BROOKLYN 
32K168,The Brooklyn School for Math and Research (BSMARt),11237,BROOKLYN 
32K552,Academy of Urban Planning,11237,BROOKLYN 
29Q313,Benjamin Franklin High School for Finance & Information Technology,11411,QUEENS   
29Q492,"Mathematics, Science Research and Technology Magnet High School",11411,QUEENS   
29Q498,Humanities & Arts Magnet High School,11411,QUEENS   
29Q243,Institute for Health Professions at Cambria Heights,11411,QUEENS   
18K566,Brooklyn Generation School,11236,BROOKLYN 
18K617,High School for Innovation in Advertising and Media,11236,BROOKLYN 
18K633,High School for Medical Professions,11236,BROOKLYN 
18K642,Urban Action Academy,11236,BROOKLYN 
18K576,Victory Collegiate High School,11236,BROOKLYN 
18K637,Academy for Conservation and the Environment,11236,BROOKLYN 
18K567,Brooklyn Theatre Arts High School,11236,BROOKLYN 
15K448,Brooklyn Secondary School for Collaborative Studies,11231,BROOKLYN 
08X376,Antonia Pantoja Preparatory Academy: A College Board School,10473,BRONX    
08X367,"Archimedes Academy for Math, Science and Technology Applications",10473,BRONX    
08X561,Bronx Compass High School,10473,BRONX    
08X432,Bronx Bridges High School,10473,BRONX    
08X305,Pablo Neruda Academy,10473,BRONX    
08X312,Millennium Art Academy,10473,BRONX    
08X452,Bronx Guild,10473,BRONX    
08X519,"Felisa Rincon de Gautier Institute for Law and Public Policy, The",10473,BRONX    
08X282,Women's Academy of Excellence,10473,BRONX    
05M148,Eagle Academy for Young Men of Harlem,10030,MANHATTAN
05M304,Mott Hall High School,10030,MANHATTAN
05M157,The Urban Assembly School for Global Commerce,10035,MANHATTAN
05M670,Thurgood Marshall Academy for Learning and Social Change,10030,MANHATTAN
05M499,Frederick Douglass Academy,10039,MANHATTAN
03M415,Wadleigh Secondary School for the Performing & Visual Arts,10026,MANHATTAN
03M860,Frederick Douglass Academy II Secondary School,10026,MANHATTAN
02M260,"Clinton School Writers & Artists, M.S. 260",10003,MANHATTAN
02M411,Baruch College Campus High School,10010,MANHATTAN
02M437,Hudson High School of Learning Technologies,10011,MANHATTAN
02M422,Quest to Learn,10011,MANHATTAN
02M412,NYC Lab School for Collaborative Studies,10011,MANHATTAN
02M419,Landmark High School,10011,MANHATTAN
02M600,The High School of Fashion Industries,10011,MANHATTAN
02M414,NYC Museum School,10011,MANHATTAN
02M392,Manhattan Business Academy,10011,MANHATTAN
02M605,Humanities Preparatory Academy,10011,MANHATTAN
02M439,Manhattan Village Academy,10010,MANHATTAN
02M294,Essex Street Academy,10002,MANHATTAN
02M282,Urban Assembly Maker Academy,10038,MANHATTAN
01M509,Marta Valle High School,10002,MANHATTAN
02M298,Pace High School,10002,MANHATTAN
02M520,Murry Bergtraum High School for Business Careers,10038,MANHATTAN
02M545,High School for Dual Language and Asian Studies,10002,MANHATTAN
02M280,Manhattan Early College School for Advertising,10038,MANHATTAN
02M135,The Urban Assembly School for Emergency Management,10038,MANHATTAN
02M543,New Design High School,10002,MANHATTAN
02M305,"Urban Assembly Academy of Government and Law, The",10002,MANHATTAN
02M308,Lower Manhattan Arts Academy,10002,MANHATTAN
09X276,Leadership Institute,10457,BRONX    
09X250,Eximius College Preparatory Academy: A College Board School,10456,BRONX    
09X260,Bronx Center for Science and Mathematics,10456,BRONX    
09X241,"Urban Assembly School for Applied Math and Science, The",10457,BRONX    
09X517,Frederick Douglass Academy III Secondary School,10456,BRONX    
09X231,Eagle Academy for Young Men,10457,BRONX    
09X252,Mott Hall Bronx High School,10457,BRONX    
09X263,Validus Preparatory Academy: An Expeditionary Learning School,10457,BRONX    
09X525,Bronx Leadership Academy High School,10457,BRONX    
02M542,Manhattan Bridges High School,10019,MANHATTAN
03M479,Beacon High School,10036,MANHATTAN
02M400,High School for Environmental Studies,10019,MANHATTAN
02M139,Stephen T. Mather Building Arts & Craftsmanship High School,10019,MANHATTAN
02M300,"Urban Assembly School of Design and Construction, The",10019,MANHATTAN
02M408,Professional Performing Arts High School (PPAS),10036,MANHATTAN
02M507,Urban Assembly Gateway School for Technology,10019,MANHATTAN
02M296,High School of Hospitality Management,10019,MANHATTAN
02M393,Business Of Sports School (BOSS),10019,MANHATTAN
02M288,Food and Finance High School,10019,MANHATTAN
02M303,"Facing History School, The",10019,MANHATTAN
02M544,Independence High School,10019,MANHATTAN
13K412,"Brooklyn Community High School of Communication, Arts and Media (BCAM)",11205,BROOKLYN 
13K670,Benjamin Banneker Academy,11205,BROOKLYN 
11X249,Bronx Health Sciences High School,10475,BRONX    
11X455,Harry S Truman High School,10475,BRONX    
24Q550,High School for Arts and Business,11368,QUEENS   
12X511,Bronx Envision Academy,10460,BRONX    
12X251,Explorations Academy,10460,BRONX    
12X682,Fannie Lou Hamer Freedom High School,10460,BRONX    
12X271,East Bronx Academy for the Future,10460,BRONX    
17K489,W.E.B. DuBois Academic High School,11225,BROOKLYN 
17K751,Academy for Health Careers,11213,BROOKLYN 
17K122,Pathways in Technology Early College High School (P-TECH),11213,BROOKLYN 
13K499,ACORN Community High School,11238,BROOKLYN 
17K547,Brooklyn Academy of Science and the Environment,11225,BROOKLYN 
17K528,The High School for Global Citizenship,11225,BROOKLYN 
17K600,Clara Barton High School,11225,BROOKLYN 
17K590,Medgar Evers College Preparatory School,11225,BROOKLYN 
17K548,Brooklyn School for Music & Theatre,11225,BROOKLYN 
17K524,International High School at Prospect Heights,11225,BROOKLYN 
19K639,Brooklyn Lab School,11208,BROOKLYN 
19K583,Multicultural High School,11208,BROOKLYN 
19K659,Cypress Hills Collegiate Preparatory School,11208,BROOKLYN 
19K618,Academy of Innovative Technology,11208,BROOKLYN 
19K764,The Urban Assembly School for Collaborative Healthcare,11208,BROOKLYN 
15K656,Brooklyn High School of the Arts,11217,BROOKLYN 
13K439,Brooklyn International High School,11201,BROOKLYN 
13K350,Urban Assembly High School of Music and Art,11201,BROOKLYN 
13K674,"City Polytechnic High School of Engineering, Architecture, and Technology",11201,BROOKLYN 
15K497,School for International Studies,11201,BROOKLYN 
15K429,Digital Arts and Cinema Technology High School (Brooklyn School for Global Studies),11201,BROOKLYN 
15K592,Khalil Gibran International Academy,11217,BROOKLYN 
13K527,Urban Assembly Institute of Math and Science for Young Women,11201,BROOKLYN 
13K483,The Urban Assembly School for Law and Justice,11201,BROOKLYN 
15K519,Cobble Hill School of American Studies,11201,BROOKLYN 
15K423,Brooklyn Frontiers High School,11201,BROOKLYN 
13K419,"Science Skills Center High School for Science, Technology and the Creative Arts",11201,BROOKLYN 
13K605,George Westinghouse Career and Technical Education High School,11201,BROOKLYN 
09X413,Bronx High School for Medical Science,10457,BRONX    
09X324,Bronx Early College Academy for Teaching & Learning,10456,BRONX    
09X329,DreamYard Preparatory School,10457,BRONX    
09X227,Bronx Collegiate Academy,10457,BRONX    
07X527,Bronx Leadership Academy II High School,10451,BRONX    
07X547,New Explorers High School,10451,BRONX    
09X564,Claremont International HS,10457,BRONX    
07X548,Urban Assembly School for Careers in Sports,10451,BRONX    
09X350,New Directions Secondary School,10457,BRONX    
09X505,"Bronx School for Law, Government and Justice",10451,BRONX    
09X412,Bronx High School of Business,10457,BRONX    
02M630,Art and Design High School,10019,MANHATTAN
18K569,Kurt Hahn Expeditionary Learning School,11203,BROOKLYN 
18K563,It Takes a Village Academy,11203,BROOKLYN 
18K629,Cultural Academy for the Arts and Sciences,11203,BROOKLYN 
04M409,Coalition School for Social Change,10035,MANHATTAN
04M435,Manhattan Center for Science and Mathematics,10029,MANHATTAN
04M372,Esperanza Preparatory Academy,10029,MANHATTAN
04M680,"Heritage School, The",10029,MANHATTAN
04M555,Central Park East High School,10029,MANHATTAN
04M610,Young Womens Leadership School (TYWLS),10029,MANHATTAN
04M495,Park East High School,10029,MANHATTAN
19K409,East New York Family Academy,11207,BROOKLYN 
19K683,"The School for Classics: An Academy of Thinkers, Writers and Performers",11208,BROOKLYN 
19K615,Transit Tech Career and Technical Education High School,11208,BROOKLYN 
19K660,W. H. Maxwell Career and Technical Education High School,11207,BROOKLYN 
19K404,Academy for Young Writers,11208,BROOKLYN 
19K504,High School for Civil Rights,11207,BROOKLYN 
19K502,FDNY  Captain Vernon A. Richards High School for Fire and Life Safety,11207,BROOKLYN 
19K507,Performing Arts and Technology High School,11207,BROOKLYN 
19K510,World Academy for Total Community Health High School (WATCH),11207,BROOKLYN 
12X372,Urban Assembly School for Wildlife Conservation,10460,BRONX    
12X684,Wings Academy,10460,BRONX    
01M450,East Side Community School,10009,MANHATTAN
14K454,Green School: An Academy for Environmental Careers,11206,BROOKLYN 
14K586,Lyons Community School,11206,BROOKLYN 
14K449,"Brooklyn Latin School, The",11206,BROOKLYN 
24Q455,Newtown High School,11373,QUEENS   
24Q236,International High School for Health Sciences,11373,QUEENS   
24Q296,Pan American International High School,11373,QUEENS   
24Q293,Civic Leadership Academy,11373,QUEENS   
27Q260,Frederick Douglass Academy VI High School,11691,QUEENS   
27Q309,Academy of Medical Technology: A College Board School,11691,QUEENS   
27Q302,"Queens High School for Information, Research, and Technology",11691,QUEENS   
10X141,Riverdale / Kingsbridge Academy (Middle School / High School 141) (RKA),10463,BRONX    
22K405,Midwood High School,11210,BROOKLYN 
17K382,Academy for College Preparation and Career Exploration: A College Board School,11226,BROOKLYN 
17K539,High School for Service & Learning at Erasmus,11226,BROOKLYN 
17K537,High School for Youth and Community Development at Erasmus,11226,BROOKLYN 
17K408,Academy of Hospitality and Tourism,11226,BROOKLYN 
17K543,"Science, Technology and Research Early College High School at Erasmus (STAR)",11226,BROOKLYN 
25Q281,East-West School of International Studies,11355,QUEENS   
25Q460,Flushing High School,11354,QUEENS   
25Q240,Veritas Academy,11354,QUEENS   
25Q241,Queens High School for Language Studies,11354,QUEENS   
28Q680,Queens Gateway to Health Sciences Secondary School,11432,QUEENS   
28Q440,Forest Hills High School,11375,QUEENS   
28Q686,Queens Metropolitan High School,11375,QUEENS   
28Q167,Metropolitan Expeditionary Learning School,11375,QUEENS   
13K430,Brooklyn Technical High School,11217,BROOKLYN 
13K265,Dr. Susan S. McKinney Secondary School of the Arts,11205,BROOKLYN 
02M551,Urban Assembly New York Harbor School,10004,MANHATTAN
02M413,School of the Future High School,10010,MANHATTAN
02M399,The High School For Language And Diplomacy,10003,MANHATTAN
02M533,Union Square Academy for Health Sciences,10003,MANHATTAN
02M420,High School for Health Professions and Human Services,10003,MANHATTAN
02M047,47 The American Sign Language and English Secondary School,10010,MANHATTAN
02M546,Academy for Software Engineering (AFSE),10003,MANHATTAN
02M407,Institute for Collaborative Education (ICE),10003,MANHATTAN
02M438,International High School at Union Square,10003,MANHATTAN
02M374,Gramercy Arts High School,10003,MANHATTAN
21K540,John Dewey High School,11223,BROOKLYN 
21K468,Kingsborough Early College School,11214,BROOKLYN 
21K572,Expeditionary Learning School for Community Leaders,11214,BROOKLYN 
21K337,International High School at Lafayette,11214,BROOKLYN 
21K348,High School of Sports Management,11214,BROOKLYN 
21K559,Life Academy High School for Film and Music,11214,BROOKLYN 
29Q259,Pathways College Preparatory School: A College Board School,11412,QUEENS   
30Q502,Information Technology High School,11101,QUEENS   
24Q610,Aviation Career & Technical Education High School,11101,QUEENS   
30Q301,Academy for Careers in Television and Film (ACTV),11101,QUEENS   
24Q267,High School of Applied Communication,11101,QUEENS   
24Q299,Bard High School Early College Queens,11101,QUEENS   
24Q520,Middle College High School at LaGuardia Community College,11101,QUEENS   
24Q560,"Robert F. Wagner, Jr. Secondary School for Arts and Technology",11101,QUEENS   
24Q264,Academy of Finance and Enterprise,11101,QUEENS   
24Q530,International High School at LaGuardia Community College,11101,QUEENS   
24Q600,Queens Vocational and Technical High School,11101,QUEENS   
08X269,Bronx Studio School for Writers and Artists,10459,BRONX    
06M211,Inwood Early College for Health and Information Technologies,10034,MANHATTAN
06M423,High School for Excellence and Innovation,10034,MANHATTAN
29Q326,Cambria Heights Academy,11423,QUEENS   
28Q687,Queens High School for the Sciences at York College,11433,QUEENS   
25Q252,"Queens School of Inquiry, The",11366,QUEENS   
25Q670,Robert F. Kennedy Community High School,11366,QUEENS   
25Q525,Townsend Harris High School,11367,QUEENS   
25Q425,John Bowne High School,11367,QUEENS   
02M459,Manhattan International High School,10065,MANHATTAN
02M449,Vanguard High School,10065,MANHATTAN
02M416,Eleanor Roosevelt High School,10021,MANHATTAN
02M519,Talent Unlimited High School,10065,MANHATTAN
03M485,Fiorello H. LaGuardia High School of Music & Art and Performing Arts,10023,MANHATTAN
03M541,Manhattan / Hunter Science High School,10023,MANHATTAN
03M494,High School of Arts and Technology,10023,MANHATTAN
03M299,The Maxine Greene High School for Imaginative Inquiry,10023,MANHATTAN
03M492,"High School for Law, Advocacy and Community Justice",10023,MANHATTAN
03M859,Special Music School,10023,MANHATTAN
03M307,"Urban Assembly School for Media Studies, The",10023,MANHATTAN
12X248,"Metropolitan High School, The",10459,BRONX    
08X332,Holcombe L. Rucker School of Community Research,10459,BRONX    
12X479,Bronx Career and College Preparatory High School,10456,BRONX    
08X530,Banana Kelly High School,10459,BRONX    
12X267,Bronx Latin,10456,BRONX    
01M292,Orchard Collegiate Academy (Henry Street School),10002,MANHATTAN
01M448,University Neighborhood High School,10002,MANHATTAN
01M539,"New Explorations into Science, Technology and Math High School (NEST+m)",10002,MANHATTAN
01M696,Bard High School Early College,10002,MANHATTAN
02M580,Richard R. Green High School of Teaching,10004,MANHATTAN
02M425,Leadership and Public Service High School,10006,MANHATTAN
02M316,"Urban Assembly School of Business for Young Women, The",10004,MANHATTAN
02M418,Millennium High School,10004,MANHATTAN
02M475,Stuyvesant High School,10282,MANHATTAN
02M489,High School of Economics and Finance,10006,MANHATTAN
22K425,James Madison High School,11229,BROOKLYN 
22K535,Leon M. Goldstein High School for the Sciences,11235,BROOKLYN 
06M540,A. Philip Randolph Campus High School,10031,MANHATTAN
05M367,Academy for Social Action,10027,MANHATTAN
05M692,"High School for Mathematics, Science and Engineering at City College (HSMSE)",10031,MANHATTAN
05M369,Urban Assembly School for the Performing Arts,10027,MANHATTAN
24Q585,Maspeth High School,11373,QUEENS   
12X321,Crotona Academy High School,10459,BRONX    
07X600,Alfred E. Smith Career and Technical Education High School,10451,BRONX    
07X473,Mott Haven Village Preparatory High School,10455,BRONX    
07X522,Bronx Design and Construction Academy,10451,BRONX    
07X495,University Heights Secondary School,10455,BRONX    
07X500,Hostos-Lincoln Academy of Science,10455,BRONX    
02M531,Repertory Company High School for Theatre Arts,10036,MANHATTAN
02M529,Jacqueline Kennedy Onassis High School,10036,MANHATTAN
21K525,Edward R. Murrow High School,11230,BROOKLYN 
05M362,Columbia Secondary School,10027,MANHATTAN
09X297,Morris Academy for Collaborative Studies,10456,BRONX    
08X559,School for Tourism and Hospitality,10456,BRONX    
09X404,School for Excellence,10456,BRONX    
09X403,Bronx International High School,10456,BRONX    
09X543,High School for Violin and Dance,10456,BRONX    
07X221,South Bronx Preparatory: A College Board School,10454,BRONX    
07X551,The Urban Assembly Bronx Academy of Letters,10451,BRONX    
07X259,"HERO High (Health, Education, and Research Occupations High School)",10455,BRONX    
07X223,M.S. 223 The Laboratory School of Finance and Technology,10454,BRONX    
07X334,International Community High School,10454,BRONX    
09X568,Young Women's Leadership School of the Bronx (TYWLS),10453,BRONX    
10X225,Theater Arts Production Company School (TaPCO),10457,BRONX    
25Q263,Flushing International High School,11355,QUEENS   
02M427,Manhattan Academy for Arts & Language,10016,MANHATTAN
02M432,Murray Hill Academy,10016,MANHATTAN
02M500,Unity Center for Urban Technologies,10016,MANHATTAN
31R600,Ralph R. McKee Career and Technical Education High School,10301,STATEN IS
31R450,Curtis High School,10301,STATEN IS
23K644,Eagle Academy for Young Men II,11233,BROOKLYN 
31R605,Staten Island Technical High School,10306,STATEN IS
31R440,New Dorp High School,10306,STATEN IS
26Q415,Benjamin N. Cardozo High School,11364,QUEENS   
23K493,Brooklyn Collegiate: A College Board School,11233,BROOKLYN 
30Q286,"Young Women's Leadership School, Astoria (TYWLS)",11102,QUEENS   
27Q308,Robert H. Goddard High School of Communication Arts and Technology,11417,QUEENS   
15K684,Millennium Brooklyn HS,11215,BROOKLYN 
15K464,Park Slope Collegiate,11215,BROOKLYN 
15K462,John Jay School for Law (Secondary School for Law),11215,BROOKLYN 
15K463,Secondary School for Journalism,11215,BROOKLYN 
11X418,Bronx High School for the Visual Arts,10462,BRONX    
31R445,Port Richmond High School,10302,STATEN IS
17K546,High School for Public Service: Heroes of Tomorrow,11203,BROOKLYN 
17K531,The School for Human Rights,11203,BROOKLYN 
18K589,Arts & Media Preparatory Academy,11203,BROOKLYN 
17K745,Brooklyn Institute for Liberal Arts (BILA),11203,BROOKLYN 
17K533,School for Democracy and Leadership,11203,BROOKLYN 
30Q258,Energy Tech High School,11106,QUEENS   
30Q580,Baccalaureate School for Global Education,11106,QUEENS   
30Q555,Newcomers High School,11101,QUEENS   
30Q575,Academy of American Studies,11101,QUEENS   
27Q475,Richmond Hill High School,11418,QUEENS   
27Q650,"High School for Construction Trades, Engineering and Architecture",11416,QUEENS   
27Q334,Epic High School - North,11419,QUEENS   
24Q485,Grover Cleveland High School,11385,QUEENS   
08X349,Bronx River High School,10461,BRONX    
08X405,Herbert H. Lehman High School,10461,BRONX    
08X558,Westchester Square Academy,10461,BRONX    
08X348,Schuylerville Preparatory High School,10461,BRONX    
08X293,Renaissance High School for Musical Theater & Technology,10461,BRONX    
08X320,Pelham Lab High School,10461,BRONX    
21K728,Liberation Diploma Plus High School,11224,BROOKLYN 
22K611,Origins High School,11235,BROOKLYN 
22K630,Professional Pathways High School,11235,BROOKLYN 
02M376,NYC iSchool,10013,MANHATTAN
02M615,Chelsea Career and Technical Education High School,10013,MANHATTAN
28Q284,York Early College Academy,11433,QUEENS   
27Q314,Epic High School - South,11420,QUEENS   
27Q480,John Adams High School,11417,QUEENS   
29Q265,Excelsior Preparatory High School,11413,QUEENS   
29Q272,George Washington Carver High School for the Sciences,11413,QUEENS   
29Q283,Preparatory Academy for Writers: A College Board School,11413,QUEENS   
27Q400,August Martin High School,11434,QUEENS   
29Q248,Queens Preparatory Academy,11413,QUEENS   
10X368,In-Tech Academy (M.S. / High School 368),10463,BRONX    
10X213,Bronx Engineering and Technology Academy,10463,BRONX    
10X284,Bronx School of Law and Finance,10463,BRONX    
10X546,Bronx Theatre High School,10463,BRONX    
10X477,Marble Hill High School for International Studies,10463,BRONX    
29Q327,Eagle Academy for Young Men III,11434,QUEENS   
15K667,Sunset Park High School,11232,BROOKLYN 
31R080,The Michael J. Petrides School,10301,STATEN IS
31R047,CSI High School for International Studies,10314,STATEN IS
31R460,Susan E. Wagner High School,10314,STATEN IS
31R064,Gaynor McCown Expeditionary Learning School,10314,STATEN IS
09X365,Academy for Language and Technology,10453,BRONX    
03M403,The Global Learning Collaborative,10024,MANHATTAN
03M417,Frank McCourt High School,10024,MANHATTAN
03M402,The Urban Assembly School for Green Careers,10024,MANHATTAN
10X442,"Celia Cruz Bronx High School of Music, The",10468,BRONX    
10X353,World View High School,10468,BRONX    
10X433,High School for Teaching and the Professions,10468,BRONX    
10X445,Bronx High School of Science,10468,BRONX    
10X237,"The Marie Curie School for Medicine, Nursing, and Health Professions",10463,BRONX    
10X351,Bronx Collaborative High School,10468,BRONX    
10X342,International School for Liberal Arts,10468,BRONX    
10X440,DeWitt Clinton High School,10468,BRONX    
10X696,High School of American Studies at Lehman College,10468,BRONX    
10X549,Discovery High School,10468,BRONX    
10X268,Kingsbridge International High School,10468,BRONX    
06M348,Washington Heights Expeditionary Learning School (WHEELS),10033,MANHATTAN
06M462,The College Academy,10040,MANHATTAN
06M468,High School for Health Careers and Sciences,10040,MANHATTAN
06M467,High School for Law and Public Service,10040,MANHATTAN
06M463,High School for Media and Communications,10040,MANHATTAN
06M293,City College Academy of the Arts,10040,MANHATTAN
06M346,Community Health Academy of the Heights,10032,MANHATTAN
06M552,Gregorio Luperon High School for Science and Mathematics,10032,
21K344,Rachel Carson High School for Coastal Studies,11224,BROOKLYN 
21K410,Abraham Lincoln High School,11235,BROOKLYN 
07X427,Community School for Social Justice,10451,BRONX    
09X327,Comprehensive Model School Project M.S. 327,10452,BRONX    
07X670,Health Opportunities High School,10451,BRONX    
12X478,The Cinema School,10472,BRONX    
12X550,High School of World Cultures,10472,BRONX    
12X242,Mott Hall V,10472,BRONX    
12X388,Pan American International High School at Monroe,10472,BRONX    
12X692,Monroe Academy for Visual Arts & Design,10472,BRONX    
