12X521,The Metropolitan Soundview High School,10472,BRONX    
02M534,Harvest Collegiate High School,10011,MANHATTAN
11X270,Academy for Scholarship and Entrepreneurship: A College Board School,10466,BRONX    
11X513,New World High School,10466,BRONX    
11X545,Bronx Aerospace High School,10467,BRONX    
11X253,Bronx High School for Writing and Communication Arts,10467,BRONX    
11X514,The Bronxwood Preparatory Academy,10466,BRONX    
11X290,Bronx Academy of Health Careers,10467,BRONX    
11X275,High School of Computers and Technology,10467,BRONX    
11X544,High School for Contemporary Arts,10467,BRONX    
11X265,Bronx Lab School,10467,BRONX    
14K558,Williamsburg High School for Architecture and Design,11211,BROOKLYN 
14K561,Williamsburg Preparatory School,11211,BROOKLYN 
14K071,Juan Morel Campos Secondary School,11206,BROOKLYN 
14K488,Brooklyn Preparatory High School,11211,BROOKLYN 
14K632,Greenpoint Art and Technical High School (Frances Perkins Academy),11222,BROOKLYN 
14K610,Automotive High School,11222,BROOKLYN 
14K685,El Puente Academy for Peace and Justice,11211,BROOKLYN 
22K555,Brooklyn College Academy,11218,BROOKLYN 
02M655,Life Sciences Secondary School,10128,MANHATTAN
